	created_at	full_text
0	Fri Jun 04 18:15:48 +0000 2021	Η Κυβέρνηση, σήμερα, έχει αποδοχή και αντοχή. Αυτό όμως δεν είναι κάτι που πρέπει να μας καθησυχάζει. Πρέπει να αναμετρηθούμε όχι μόνο με το παρόν και με το μέλλον, αλλά και με τις προσδοκίες που έχουν οι πολίτες από μας. https://t.co/ln8KenzYMN https://t.co/A6va302snu
1	Fri Jun 04 18:15:46 +0000 2021	Η Νέα Δημοκρατία είναι ένας ζωντανός μηχανισμός διαβούλευσης με την κοινωνία. Θέλω να ενθαρρύνω όλα τα στελέχη μας να κρατήσουν ενεργό αυτόν τον τολμηρό, καινοτόμο, πρωτοποριακό, προοδευτικό ρόλο του κόμματος, καθώς σιγά σιγά αποκαθιστούμε τους ρυθμούς της κανονικότητας. https://t.co/TMekAXYS7i
2	Fri Jun 04 18:12:14 +0000 2021	Το 14ο Συνέδριο της ΝΔ θα γίνει Δεκέμβριο 2021. Είναι σημαντικό να κρατάμε την παράδοση των ετήσιων Συνεδρίων. Φέτος συμπίπτει με την εμβληματική χρονιά των 200 ετών από την έναρξη της ελληνικής Επανάστασης και με τα 40 χρόνια από την είσοδο της Ελλάδας στην ευρωπαϊκή οικογένεια. https://t.co/8imW5WZqkx
3	Thu Apr 29 16:56:25 +0000 2021	Η Μαρία Τσάκος ήταν ένας φωτεινός και ζεστός άνθρωπος. Είχα τη χαρά να τη γνωρίζω και η είδηση της απώλειάς της με στεναχώρησε βαθύτατα. Λέμε αντίο σε έναν υπέροχο άνθρωπο και σε μία πραγματικά φιλελεύθερη και προοδευτική φωνή. Ειλικρινή συλλυπητήρια στους αγαπημένους της.
4	Fri Mar 19 10:51:09 +0000 2021	Είναι πολύ όμορφο και συγκινητικό να βλέπεις για πρώτη φορά τον Εθνικό μας Ύμνο να αποδίδεται στη νοηματική γλώσσα. Συγχαρητήρια στους συντελεστές, εμπνευστές και εκτελεστές! https://t.co/6i28KceYMY
5	Wed Mar 17 19:01:50 +0000 2021	Thank you @jchatterleyCNN for a great discussion on the EU Digital Green Certificate. https://t.co/BUrnruDAjk
6	Wed Mar 03 19:24:13 +0000 2021	Ο στόχος μας ήταν πάντα να εγγυηθούμε ότι θα παραμείνει ακέραια η παραγωγική ικανότητα της χώρας, για να μπορέσουμε να επανεκκινήσουμε την οικονομική δραστηριότητα με το τέλος της πανδημίας. Σε διαδικτυακή συζήτηση που διοργάνωσε το @EPPGroup. https://t.co/nwGMA32k3Y
7	Wed Mar 03 19:24:12 +0000 2021	Όταν αφήσουμε πίσω μας την πανδημία, η προτεραιότητα της Ελλάδας θα είναι όχι μόνο να διασφαλίσουμε τη διατήρηση των υφιστάμενων θέσεων, αλλά να αντιμετωπίσουμε την εγγενή ανεργία με νέες, βιώσιμες θέσεις εργασίας που θα αμείβονται καλά. https://t.co/xbIW8cIkSk
8	Thu Feb 11 09:18:26 +0000 2021	"Θέλουμε πανεπιστήμια γνώσης και καινοτομίας, σε ένα περιβάλλον ασφάλειας και ελευθερίας. 

Και σε αυτά τα πανεπιστήμια, δεν χωράει η βία. Δεν χωράει ο εκφοβισμός. https://t.co/h73BnblIoQ"
9	Mon Jan 25 13:16:58 +0000 2021	RT @wef: Responding to the COVID-19 Crisis with John Micklethwait (@business), Anthony S. Fauci (@NIAIDNews), @NancyatHeart, Frans van Hout…
10	Sun Jan 24 20:07:00 +0000 2021	Εύχομαι περαστικά και ταχεία ανάρρωση στον γιο του κ. Τσίπρα και να ξεπεράσει η οικογένεια γρήγορα αυτήν τη δοκιμασία.
11	Mon Jan 18 14:10:00 +0000 2021	"Η Ελλάδα είναι έτοιμη να αυξήσει σημαντικά τους αριθμούς των εμβολίων. Είμαστε όμως εξαρτημένοι από τον αριθμό των εμβολίων που θα παραλάβουμε. Προφανώς, όσο περισσότερα εμβόλια παραλάβουμε τόσο πιο γρήγορα θα προχωρήσουμε.

Εισήγηση στην ΚΟ της ΝΔ. https://t.co/eWvSwrpKXF https://t.co/miCq4rOszM"
12	Mon Jan 18 14:09:58 +0000 2021	Έχουμε καλά επιδημιολογικά δεδομένα τις τελευταίες εβδομάδες, τα οποία επέτρεψαν στους ειδικούς να εισηγηθούν το άνοιγμα του λιανεμπορίου. Χαιρετίζουμε αυτή την εξέλιξη, θέλω όμως να επαναλάβω ότι αυτό το στοίχημα πρέπει να το κερδίσουμε όλοι, με συμπεριφορές υπευθυνότητας.
13	Mon Jan 18 14:09:57 +0000 2021	Σε κοινοβουλευτικό επίπεδο, αφιερώνουμε τις συνεδριάσεις των πρώτων εβδομάδων του έτους σε κρίσιμα θέματα εξωτερικής πολιτικής. Ολοκληρώσαμε τη σύμβαση αγοράς των αεροσκαφών Rafale και αυτές τις μέρες θα ψηφιστεί η επέκταση των χωρικών υδάτων προς δυσμάς στα 12 μίλια. https://t.co/BimoUzN4KA
14	Sat Jan 16 13:53:50 +0000 2021	Congratulations to @ArminLaschet on his election as the new chairman of the CDU. My friend Armin and I share the same values in the great @EPP family. I wish him every success for the benefit of bilateral relations and the strengthening of European cooperation and solidarity. https://t.co/0BLU6baELz
15	Fri Jan 01 11:47:56 +0000 2021	"Καλή χρονιά! Με υγεία και αισιοδοξία! 
#2021 🇬🇷 https://t.co/kT4pqTmxeO"
16	Fri Dec 18 14:45:50 +0000 2020	Ο τηλε-μαραθώνιος της @ONNED για την ενίσχυση των άστεγων συμπολιτών μας αξίζει κάθε στήριξη. Η κοινωνική δράση και ο εθελοντισμός αποτελούν τον δικό μας πολιτικό ακτιβισμό. Αυτές τις γιορτές, στέλνουμε #μαζί_από_απόσταση μήνυμα αλληλεγγύης και αγάπης. https://t.co/OBZhNDCHvo
17	Tue Dec 15 13:37:21 +0000 2020	"Οι αρχές, οι επιλογές και οι πολιτικές συμπεριφορές Ομπάμα αξίζουν να περάσουν τον Ατλαντικό για να φτάσουν στην Ευρώπη και στην Ελλάδα.

Μήνυμα στην παρουσίαση της ελληνικής έκδοσης του βιβλίου του Barack Obama «Γη της Επαγγελίας»."
18	Tue Dec 15 13:36:50 +0000 2020	Ως αναγνώστης-πολιτικός του βιβλίου του Προέδρου Obama «Γη της Επαγγελίας» θα επισήμαινα την προσήλωση του Προέδρου στις αρχές της φιλελεύθερης Δημοκρατίας, του εκσυγχρονισμού και της κοινωνικής φροντίδας. Αλλά και την πίστη του στην μετριοπάθεια. https://t.co/RAEccjyz7Y
19	Tue Dec 08 15:11:13 +0000 2020	"Προφανώς στη μεγάλη προσπάθεια του εμβολιασμού, το παράδειγμα του καθενός και της καθεμιάς από εμάς είναι πάρα πολύ σημαντικό και σε τοπικό επίπεδο. 

Εισήγηση στη συνεδρίαση της Κοινοβουλευτικής Ομάδας της ΝΔ. https://t.co/fbBtd2Zh8g https://t.co/5KDWGES4cb"
20	Tue Dec 08 15:11:11 +0000 2020	Ο προϋπολογισμός του ‘21 έχει πολλούς αστάθμητους παράγοντες. Ο σημαντικότερος είναι πόσο θα κρατήσει η υγειονομική κρίση και αυτό βρίσκεται σε άμεση συνάρτηση με το πόσο γρήγορος και το πόσο αποτελεσματικός θα είναι ο εμβολιασμός που θα βάλει τίτλους τέλους σε αυτή την κρίση.
21	Tue Dec 08 15:09:53 +0000 2020	Ο προϋπολογισμός έχει εφεδρείες για να στηρίξουμε την οικονομία και για το πρώτο διάστημα του 2021, όπου ξέρουμε ότι τα πράγματα θα είναι ακόμα δύσκολα. Όμως έχουμε στρώσει το χαλί με σημαντικές μεταρρυθμίσεις υποδομής για να δρομολογήσουμε τη δυναμική ανάπτυξη μετά την πανδημία. https://t.co/OdMbUHugFL
22	Thu Dec 03 19:37:11 +0000 2020	Διάβασα αυτή την ανάρτηση και πραγματικά με συγκίνησε. Έχουμε ακόμη πολύ δρόμο και πολλή δουλειά μπροστά μας για να βελτιώσουμε την προσβασιμότητα και την ποιότητα ζωής των Ατόμων με Αναπηρία στην Ελλάδα. Αλλά θα το κάνουμε, βήμα βήμα, έργο έργο. https://t.co/yaWv7eU5r1
23	Sat Nov 07 13:58:50 +0000 2020	Η έμπρακτη έκφραση αλληλεγγύης επιβάλλει να ακούμε τους ειδικούς και να δεχτούμε την ανάγκη να περιοριστούμε πρόσκαιρα για να στηρίξουμε τον κοινό αγώνα και να συγκρατήσουμε το 2ο κύμα της πανδημίας. Ως συνειδητοί πολίτες επιλέγουμε να κάνουμε το σωστό. https://t.co/dK7X75eKn3 https://t.co/JA8fiQ3QgD
24	Tue Nov 03 12:37:53 +0000 2020	"Έχουμε υποχρέωση κάθε μέρα να γινόμαστε καλύτεροι, να μαθαίνουμε από τα λάθη μας, να τα διορθώνουμε και να προχωράμε μπροστά. 
Εισαγωγική τοποθέτηση στη συνεδρίαση μέσω τηλεδιάσκεψης της ΚΟ της Νέας Δημοκρατίας. https://t.co/1XWMgU7V28 https://t.co/xMivAejEeR"
25	Tue Nov 03 12:31:54 +0000 2020	Υπάρχει ένας ειδικός ρόλος για τους βουλευτές που βρίσκονται σε ιδιαίτερα επιβαρυμένες περιοχές. Να παρακολουθείτε την πρόοδο των διαδικασιών και των μέτρων αποκατάστασης και στήριξης αλλά και να “ενοχλείτε” την κυβέρνηση, όποτε κρίνετε ότι υπάρχουν καθυστερήσεις ή αστοχίες.
26	Tue Nov 03 12:30:34 +0000 2020	Αντιμετωπίζουμε πολλές προκλήσεις ταυτόχρονα, θέλω όμως να εκφράσω την απόλυτη ικανοποίησή μου από τον τρόπο λειτουργίας της Κοινοβουλευτικής Ομάδας. Είναι πολύ σημαντικό σε καμία περίπτωση να μην ανασταλεί το μεταρρυθμιστικό έργο της Κυβέρνησης λόγω Covid. https://t.co/VbjDNJISsm
27	Sun Oct 04 10:10:51 +0000 2020	Σαράντα έξι χρόνια. Πολύ λίγα μπροστά στα πολλά που πετύχαμε. Και λιγότερα μπροστά στα περισσότερα που μπορούμε. Θα τα πετύχουμε δίπλα σε κάθε Ελληνίδα  και Έλληνα. Χρόνια πολλά, Νέα Δημοκρατία! https://t.co/K9zQvYDrtu
28	Sat Sep 26 08:47:37 +0000 2020	Τριάντα ένα χρόνια μετά. Η ίδια αγάπη ζωντανή στη μνήμη μου. https://t.co/C3KQ6Klke6
29	Tue Sep 08 17:12:44 +0000 2020	I presented to the @EPPgroup evidence of the provocative actions of Turkey in the Eastern Mediterranean. Greece is an advocate for dialogue, since we have absolute faith in our positions. However, real dialogue cannot be pursued under threat or violations of our sovereign rights. https://t.co/CpBc4HYJu7
30	Mon Aug 17 15:36:22 +0000 2020	RT @StefTsitsipas: Όσοι αγαπάμε μπορεί να είναι πιο ευάλωτοι από εμάς στον κορωνοϊό. Γι' αυτό αγκάλιασε τα μέτρα προστασίας. Για να μπορέσο…
31	Tue Jul 07 12:29:56 +0000 2020	Η Ελλάδα απέδειξε ότι μπορεί να αλλάξει, μπορεί να τρέξει με μεγάλη ταχύτητα προς το μέλλον και να δείξει πολύ μεγάλη προσαρμοστικότητα. Αν κάτι φάνηκε αυτούς τους 12 μήνες, είναι ότι ναι, μπορούμε να κάνουμε πολλά πράγματα και μπορούμε να αλλάξουμε τη χώρα. https://t.co/zVSxUwhfrB
32	Tue Jul 07 12:26:52 +0000 2020	Μετά από σχεδόν 3 μήνες πειθαρχίας, παντού στον κόσμο βλέπουμε φαινόμενα χαλάρωσης στα μέτρα προστασίας για τον κορωνοϊό. Όμως έχουμε μία υποχρέωση απέναντι στους συμπολίτες μας, κυρίως στους ηλικιωμένους, τους χρόνια πάσχοντες, να είμαστε υπεύθυνοι στις συμπεριφορές μας.
33	Tue Jul 07 12:23:24 +0000 2020	Οι φόροι μειώθηκαν. Ξεκίνησαν σημαντικές επενδύσεις στη χώρα. Η κατάσταση στο μέτωπο της τάξης και της ασφάλειας αναμφισβήτητα βελτιώθηκε. Αυτές ήταν κεντρικές μας δεσμεύσεις προς τον ελληνικό λαό, και παρά τις δυσκολίες, παραμείναμε συνεπείς στην υλοποίησή τους. https://t.co/Kl36oWOg2h
34	Tue Jul 07 12:16:48 +0000 2020	Στο τέλος της εβδομάδας θα έχουμε ψηφίσει συνολικά 85 νομοσχέδια με σημαντικές μεταρρυθμιστικές πρωτοβουλίες. Τους 12 αυτούς μήνες αντιμετωπίσαμε κρίσεις, αλλά ταυτόχρονα ήμασταν πιστοί στις δεσμεύσεις μας προς τους πολίτες, να προτάξουμε την οικονομία και τις μεγάλες αλλαγές.
35	Tue Jul 07 12:12:00 +0000 2020	Η χώρα σήμερα είναι πιο ισχυρή από ότι ήταν πριν από 6 μήνες. Έχει περισσότερο θεσμικό κεφάλαιο. Έχει περισσότερη εμπιστοσύνη στις δυνατότητές της. Και έχει την αισιοδοξία ότι μπορεί να τα βγάλει πέρα σε δύσκολες καταστάσεις. https://t.co/ns0NiRZ4Fq
36	Mon Jun 29 16:25:58 +0000 2020	Στην προσπάθεια αντιμετώπισης του κορωνοϊού στρατεύτηκε ολόκληρη η ελληνική κοινωνία. Χωρίς τη συμμετοχή της πλειοψηφίας και κυρίως των νέων, δεν θα μπορούσαμε να περιορίσουμε το πρώτο κύμα της πανδημίας. Διαδικτυακή συζήτηση της @ONNED με θέμα «Οι νέοι που νίκησαν την πανδημία». https://t.co/M9WI7TVSGU
37	Wed Jun 10 18:04:48 +0000 2020	Οι οργανώσεις μας σε όλη την Ελλάδα, ενσωματώνοντας ψηφιακές υπηρεσίες στην καθημερινή τους λειτουργία, βρίσκονται ακόμα πιο κοντά στις τοπικές κοινωνίες για να μεταφέρουν τις αγωνίες και τις επισημάνσεις τους, τις προσδοκίες και τις προτάσεις τους. https://t.co/Rro6nJVcXo https://t.co/r7PZXv4rpt
38	Sat May 02 12:17:41 +0000 2020	Είναι σημαντικό το κόμμα να είναι εναρμονισμένο με το ρυθμό που δίνει η ίδια η κοινωνία. Να εκπέμπουμε μήνυμα ενότητας, να ενημερώνουμε για τις πρωτοβουλίες μας, να μεταφέρουμε τα μηνύματα της κοινωνίας και να διορθώνουμε τα λάθη οπότε αυτά επισημαίνονται. https://t.co/8DqSM5jFhN
39	Sun Apr 26 08:54:14 +0000 2020	Ένα όμορφο βίντεο για τον κορωνοϊό - η παιδική μάτια βρίσκει τον πιο δημιουργικό τρόπο να περιγράψει την πραγματικότητα. Τα παιδιά αναγκάζονται κι αυτά να μείνουν σπίτι, κανένας όμως δεν μπορεί να περιορίσει τη φαντασία τους. Μπράβο στη Μέλπω και στη Λουίζα! https://t.co/KE2CQ6XGA7
40	Thu Apr 16 13:48:30 +0000 2020	On behalf of the Greek people, I would like to thank @harari_yuval for his kind words. During these trying times, everyone has had to make sacrifices, but we stand united and determined in the fight against COVID-19. https://t.co/Z8jkQlEerM
41	Thu Mar 26 17:31:55 +0000 2020	Αυτές τις μέρες, φροντίζουμε τη σωματική αλλά και την ψυχολογική μας υγεία. Η Α΄ Ψυχιατρική Κλινική της Ιατρικής Σχολής του Εθνικού &amp; Καποδιστριακού Πανεπιστημίου Αθηνών εκπόνησε οδηγίες Ψυχολογικής Υποστήριξης Πολιτών λόγω του κορονοϊού. Δείτε τις εδώ: https://t.co/zYRfylX4pF https://t.co/nIjzrj09sg
42	Thu Mar 12 15:44:22 +0000 2020	Ευχαριστούμε Στέφανε! Είναι σημαντικό να συμβάλουμε όλοι, αναλογιζόμενοι ότι δεν είμαστε υπεύθυνοι μόνο για τον εαυτό μας. Αλλά και για όλες τις Ελληνίδες και όλους τους Έλληνες δίπλα μας. https://t.co/Jzf2e34D30
43	Sun Feb 23 10:53:54 +0000 2020	Κάποιοι επενδύουν στις επιτυχίες μας και θέλουν γρήγορες εκλογές. Είναι η καλύτερη τακτική, υποστηρίζουν. Κάνουν μεγάλο λάθος. Οι πολίτες δεν μας εξέλεξαν για να κάνουμε τακτικισμούς, αλλά για να φέρουμε αποτέλεσμα. Και θα φέρουμε! https://t.co/bgXTD5s8tk
44	Sun Feb 23 10:48:13 +0000 2020	Ψηφίζεται άμεσα ο νέος νόμος για τις συγκεντρώσεις και πορείες στο κέντρο των πόλεων. Στο εξής, το δικαίωμα κάποιων να διαδηλώνουν δεν θα γίνεται εμπόδιο για την καθημερινή ζωή και κίνηση των υπολοίπων. Η Ελλάδα θα γίνει μία σύγχρονη χώρα και η Αθήνα μία ευρωπαϊκή πρωτεύουσα.
45	Sun Feb 23 10:45:42 +0000 2020	Τα σύνορα πλέον φυλάσσονται πιο αποτελεσματικά. Το Λιμενικό ενισχύθηκε σε προσωπικό, σκάφη και τεχνικά μέσα. Το νέο πλαίσιο επιταχύνει τις διαδικασίες ασύλου. Δρομολογούνται νέες ελεγχόμενες δομές. Τα έργα ξεκινούν και θα ολοκληρωθούν. Δεν υπάρχει περιθώριο για πισωγύρισμα.
46	Sun Feb 23 10:43:15 +0000 2020	Όσο και αν κάποιοι έλεγαν ότι «αυτά δεν γίνονται στην Ελλάδα», ο νέος αντικαπνιστικός νόμος εφαρμόζεται παντού και από την συντριπτική πλειοψηφία των πολιτών. Γιατί οι συνειδήσεις αλλάζουν, όταν επικρατούν μεταρρυθμίσεις που εκσυγχρονίζουν και εξευγενίζουν την καθημερινότητά μας.
47	Sun Feb 23 10:42:06 +0000 2020	Στις γειτονιές περιπολούν 1.500 νέοι αστυνομικοί. Επανακτώνται κτίρια που έμεναν για χρόνια υπό κατάληψη. Το πραγματικό άσυλο των ιδεών επιστρέφει στα πανεπιστήμια. Η Αντιτρομοκρατική σημειώνει επιτυχίες. Ενώ σχεδιάζεται μεθοδικά η μετεγκατάσταση των φυλακών Κορυδαλλού.
48	Sun Feb 23 10:39:59 +0000 2020	Μειώθηκαν κατά 7% οι τιμές σε 3.000 φάρμακα. Όλα τα νοσοκομεία αναβαθμίζονται. Έρχονται προσλήψεις νοσηλευτών και γιατρών. Προωθείται κοινό ηλεκτρονικό σύστημα προμηθειών, ώστε να εξοικονομηθούν πόροι. Και σε 3 νοσοκομεία θα δοκιμαστούν πιλοτικά προγράμματα με ιδιωτικούς φορείς. https://t.co/QBT4w8eHpB
49	Sun Feb 23 10:39:03 +0000 2020	Τα σχολεία εκσυγχρονίζονται. Εκπαιδευτικοί θα επιμορφώνονται και θα αξιολογούνται συνεχώς. Η τεχνική Παιδεία θα προσφέρει εξειδικευμένη και άμεση επαγγελματική αποκατάσταση. Και στα πανεπιστήμια ήδη ξεκίνησαν τα ξενόγλωσσα τμήματα και οι διεθνείς συνεργασίες.
50	Sun Feb 23 10:36:16 +0000 2020	Η Ελλάδα αλλάζει: από την περασμένη Πέμπτη, κάθε παιδί που γεννιέται συνοδεύεται από μία ενίσχυση €2.000 στους γονείς του. Παίρνει αυτομάτως, με μία απλή δήλωση στο μαιευτήριο, ΑΜΚΑ και αριθμό δημοτικού μητρώου. Χωρίς την παραμικρή γραφειοκρατία.
51	Sun Feb 23 10:32:46 +0000 2020	Είχα πει ότι οι εκλογές αφορούσαν την ποιότητα της δημοκρατίας. Τα λόγια μου δυστυχώς επιβεβαιώνονται. Ο κ. Τσίπρας ομολόγησε ότι θα επιδιώξει να ελέγξει και τους άλλους «αρμούς της εξουσίας», ότι δεν θα διστάσει να καταργήσει τη διάκριση των εξουσιών -το θεμέλιο της Δημοκρατίας.
52	Sun Feb 23 10:32:04 +0000 2020	Η σύγκριση είναι συντριπτική. Δεν είναι ζήτημα αριστείας, που τόσο απασχολεί τον ΣΥΡΙΖΑ, αλλά ζήτημα γνώσης και αποτελεσματικότητας. Εκεί απέτυχαν εκείνοι, εκεί πετυχαίνουμε εμείς για να υπηρετήσουμε τον εθνικό και κοινωνικό στόχο: Την Ανάπτυξη για Όλους. Το είπαμε, το κάναμε! https://t.co/ojAGnjQYZP
53	Sun Feb 23 10:27:05 +0000 2020	Ο κ. Τσίπρας παρουσίασε μία εικόνα της χώρας που μόνο εκείνος βλέπει. Δεν μπορεί να καταλάβει τίποτα από όσα συμβαίνουν στην οικονομία. Για να απολογηθεί στα εθνικά, κατέφυγε στα λόγια των Τούρκων. Και ενώ υποδύεται τον οικολόγο, κατέληξε να υπερασπίζεται τον λιγνίτη.
54	Sun Feb 23 10:26:12 +0000 2020	Ιδρύθηκε η Αρχή Διαφάνειας που συντονίζει όλους τους ελεγκτικούς μηχανισμούς. Νοικοκυριά &amp; επιχειρήσεις πληρώνουν λιγότερους φόρους &amp; εισφορές. Η Ελλάδα δανείζεται πια με αρνητικό επιτόκιο. Προχωρούν 9 στρατηγικές επενδύσεις, 11 έργα ΣΔΙΤ, 180 επιχειρηματικά σχέδια: σύνολο 4 δισ.
