	created_at	full_text
640	Wed Mar 06 12:33:03 +0000 2019	Το στεφάνι που κατέθεσα στη μνήμη όσων αγωνίστηκαν για την απελευθέρωση της Δωδεκανήσου είχε έναν επιπλέον συμβολισμό. Μου το έδωσε ο Χρήστος, ο μοναδικός μαθητής των Αρκιών, που κάθε χρόνο κάνει παρέλαση μόνος του κρατώντας περήφανα τη σημαία. Το χαμόγελό του μας γεμίζει ελπίδα. https://t.co/HhgEEb8rYL
641	Wed Mar 06 11:53:57 +0000 2019	Η ημέρα κατά του σχολικού εκφοβισμού είναι μια ευκαιρία να συζητήσουμε ανοιχτά με τα παιδιά μας και τους εκπαιδευτικούς μας για το bullying. Ζητούμενο ωστόσο είναι να πολεμήσουμε το σχολικό εκφοβισμό στη ρίζα του. Αυτό θα κάνει η επόμενη κυβέρνηση της ΝΔ με συγκεκριμένες δράσεις. https://t.co/rkhIqw4n9m
642	Tue Mar 05 21:21:12 +0000 2019	Με την Υπουργό Άμυνας της Γερμανίας κ. Ούρσουλα Φον ντερ Λάιεν συζητήσαμε για θέματα Άμυνας και Ασφάλειας. Σε ένα περιβάλλον γεωπολιτικών ανακατατάξεων είναι αναγκαίο η Ε.Ε να υπερβεί τον εαυτό της και να προσχωρήσει σε ισχυρότερη αμυντική συνεργασία. https://t.co/Utgjf7N7yI https://t.co/D1zauPczx8
643	Tue Mar 05 16:19:51 +0000 2019	RT @neademokratia: Live | Συζήτηση του Προέδρου της Ν.Δ. κ. Κυριάκου Μητσοτάκη με την Υπουργό  Άμυνας της Γερμανίας κ. Ursula von der Leyen…
644	Tue Mar 05 12:08:55 +0000 2019	Θέλουμε Έλληνες ελεύθερους από τα βάρη της τρέχουσας καθημερινότητας. Να αισθάνονται την προστατευτική ομπρέλα της πολιτείας, αλλά και να έχουν την ευκαιρία της προσωπικής ανέλιξης. Και να δημιουργούν οικογένειες με πολλά παιδιά, το μέλλον των οποίων θα είναι εξασφαλισμένο.#vouli
645	Tue Mar 05 11:59:35 +0000 2019	Προτείνουμε συγκεκριμένες κινήσεις προστασίας και διευκόλυνσης για τους νέους γονείς και κυρίως για τις νέες μητέρες. Και προωθούμε τη στήριξη στις τρίτεκνες και πολύτεκνες οικογένειες, που παραμένει στο κέντρο κάθε σχεδίου για την αντιμετώπιση του δημογραφικού. #vouli https://t.co/igMFY9i4Mk
646	Tue Mar 05 11:43:51 +0000 2019	Το σχέδιο της Ν.Δ. για το δημογραφικό περιλαμβάνει σαφή και χειροπιαστά μέτρα. Αρχίζουμε με κίνητρα και διευκολύνσεις για τους νέους γονείς ώστε κανένα νέο ζευγάρι να μη διστάζει να προχωρήσει στην απόκτηση παιδιών. #vouli https://t.co/yz3tiBFTPT
647	Tue Mar 05 11:39:13 +0000 2019	Η Ν.Δ. εισηγείται ένα σχέδιο 4 κατευθύνσεων για το δημογραφικό: Μείωση του βάρους για την απόκτηση παιδιού. Στήριξη των εργαζόμενων γονέων -κυρίως των γυναικών- και των μεγάλων οικογενειών. Επιστροφή των νέων που έφυγαν. Και διαγενεακή αλληλεγγύη μέσω ενός σύγχρονου Ασφαλιστικού.
648	Tue Mar 05 11:24:58 +0000 2019	Ζωντανά η ομιλία μου στη Βουλή στη συζήτηση για το δημογραφικό. #vouli https://t.co/DCyZKoggUV
649	Tue Mar 05 08:32:45 +0000 2019	I sincerely hope the 10yr bond issue is successful. The fact remains that markets anticipate political change in #Greece. The coming @neademokratia government will deliver investment grade status within 18 months.
650	Mon Mar 04 17:40:25 +0000 2019	Μικρότερα πλεονάσματα σημαίνουν λιγότεροι φόροι για τους πολίτες και μικρότερες εισφορές για εργαζόμενους και εργοδότες. Δίνουν χώρο να αναπτυχθεί η οικονομία και να δημιουργηθούν θέσεις εργασίας. Και σημαίνουν ένα πιο ουσιαστικό κοινωνικό κράτος που στηρίζει όσους έχουν ανάγκη. https://t.co/aSumuhaPgW
651	Mon Mar 04 14:56:21 +0000 2019	Επισκέφθηκα το ΑΤ Ακρόπολης για να εκφράσω τη συμπαράστασή μου στους άνδρες και τις γυναίκες της Ελληνικής Αστυνομίας. Θα στηρίξουμε την Αστυνομία και θα της παρέχουμε απόλυτη πολιτική κάλυψη για να μπορεί να κάνει τη δουλειά της σωστά, ώστε να αισθάνονται οι πολίτες ασφαλείς. https://t.co/WHeISEX25H
652	Mon Mar 04 10:29:24 +0000 2019	Η εκλογή του Αθ. Εξαδάκτυλου με 62% στην Προεδρία του Πανελλήνιου Ιατρικού Συλλόγου είναι σημαντική. Όχι μόνον γιατί σε μια ακόμη κάλπη αποδοκιμάζεται ο ΣΥΡΙΖΑ, αλλά γιατί δείχνει ότι ο ιατρικός κόσμος έχει αγκαλιάσει το πρόγραμμα της Ν.Δ. για την αναβάθμιση της δημόσιας υγείας.
653	Sun Mar 03 19:54:17 +0000 2019	Δεν είναι πρόοδος ότι είμαστε η μόνη χώρα στον κόσμο που δεν επιτρέπει την ίδρυση ιδιωτικών πανεπιστημίων. Ούτε είναι πρόοδος να υπερφορολογείς τη μεσαία τάξη για να μοιράζεις περιστασιακά επιδόματα. Πρόοδος είναι να δίνεις ευκαιρίες στους πολίτες ώστε να σταθούν στα πόδια τους. https://t.co/0iiM2RfiKq
654	Sun Mar 03 19:49:48 +0000 2019	Αν δεν αλλάξουμε κάτι, μέχρι το 2050 θα είμαστε μόλις 7 εκατομμύρια. Δεν μπορούμε να το επιτρέψουμε να συμβεί. Θα στηρίξουμε την οικογένεια, με 2,000 ευρώ για κάθε παιδί που γεννιέται στην Ελλάδα. Και θα στηρίξουμε τις μητέρες. Κανένα παιδί δεν θα μείνει εκτός παιδικών σταθμών. https://t.co/Zzo41dCaXc
655	Sun Mar 03 19:41:51 +0000 2019	Ο κ. Τσίπρας είπε πως διεκδικώ μικρότερα πρωτογενή πλεονάσματα διότι θέλω να ευνοήσω το “μεγάλο κεφάλαιο”. Του εξηγώ λοιπόν: Μικρότερα πρωτογενή πλεονάσματα σημαίνουν λιγότεροι φόροι για κάθε Ελληνίδα, για κάθε Έλληνα. Σημαίνει χαμηλότερες εισφορές πρωτίστως για τον εργαζόμενο. https://t.co/OyZn6lOC6A
656	Sun Mar 03 16:55:46 +0000 2019	Επισκέφτηκα το Γυναικείο Συνεταιρισμό Φτελιά στον Πτελεό. Συνάντησα γυναίκες που με μεράκι παρασκευάζουν χειροποίητα τοπικά προϊόντα. Το μεγαλύτερο πρόβλημα που αντιμετωπίζουν είναι η υψηλή φορολογία. Τις ευχαριστώ από καρδιάς για τον χρόνο που μου αφιέρωσαν και για το κέρασμα! https://t.co/opo5Mreg39
657	Sun Mar 03 14:18:25 +0000 2019	Ο Γιάννης Μπεχράκης έλεγε ότι «μια φωτογραφία μπορεί να αλλάξει τον κόσμο, να τον κάνει πιο δίκαιο». Με τις φωτογραφίες του κατόρθωσε να δούμε την πραγματικότητα με ξεχωριστή ματιά. Για τον πρόωρο χαμό του εκφράζω στους οικείους του τα πιο θερμά μου συλλυπητήρια.
658	Sun Mar 03 13:09:33 +0000 2019	Συγχαρητήρια στον Μίλτο Τεντόγλου για το χρυσό στο μήκος και στην Βούλα Παπαχρήστου για το ασημένιο στο τριπλούν στο #Glasgow2019. Ένας νέος αθλητής με όλο το μέλλον μπροστά του και μια έμπειρη αθλήτρια με σπάνια επιμονή μας έκαναν υπερήφανους. Μπράβο και στους δύο!
659	Sat Mar 02 19:21:32 +0000 2019	Συγχαρητήρια στον Κώστα Μπανιώτη, που απόψε, στο Ευρωπαϊκό Πρωτάθλημα Κλειστού Στίβου της Γλασκώβης, κατέκτησε το ασημένιο μετάλλιο στο ύψος με άλμα στα 2.26 μέτρα, κάνοντας την Κομοτηνή και την Ελλάδα υπερήφανη! #Glasgow2019
660	Sat Mar 02 09:31:21 +0000 2019	Την εβδομάδα που πέρασε επισκέφθηκα το Νυχτερινό σχολείο στο Αιγάλεω. Και ειλικρινά ήταν μια από τις πιο συγκινητικές στιγμές στα 15 χρόνια που είμαι στην πολιτική. https://t.co/aFQQpMStrM
661	Fri Mar 01 18:01:32 +0000 2019	Είναι απαράδεκτες οι παρεμβάσεις του κ. Όρμπαν στο Κράτος Δικαίου. Τη Δευτέρα θα ζητήσω με επιστολή μου να ανασταλεί η συμμετοχή του κόμματός του στο ΕΛΚ. Ο λαϊκισμός των κ. Όρμπαν και Τσίπρα δεν διαφέρει. Η ΕΕ οφείλει να αποδοκιμάσει όσους προσβάλλουν τις αξίες της.#delphi_forum https://t.co/epzYp36gxb
662	Fri Mar 01 16:54:32 +0000 2019	Όταν ζητούσα τη μείωση των πλεονασμάτων πριν από 3 χρόνια ήμουν μόνος. Τώρα όλο και περισσότεροι κατανοούν τη σημασία της πρότασής μου για την αναπτυξιακή προοπτική της Ελλάδας. Το ανέφεραν ο κ. Βέμπερ και ο κ. Μοσκοβισί. Ο μόνος που δεν το συζητά είναι ο κ. Τσίπρας.#delphi_forum https://t.co/GMTgVPJgkd
663	Fri Mar 01 16:48:40 +0000 2019	Από την ανάπτυξη της οικονομίας πρέπει να κερδίζουν πρωτίστως οι εργαζόμενοι. Αυτό είναι το βασικό μου μέλημα: να κάνω τη ζωή των Ελλήνων καλύτερη. Θέλω να τους προσφέρω κίνητρα, ευκαιρίες και ελπίδα, αυτά δηλαδή που τους έχει στερήσει η σημερινή κυβέρνηση. #delphi_forum https://t.co/yTNRgRAbLc
664	Fri Mar 01 13:13:52 +0000 2019	Ζωντανά στο 4ο Οικονομικό Φόρουμ Δελφών. #delphi_forum https://t.co/X6zagAbOfC
665	Fri Mar 01 10:24:01 +0000 2019	Yet another example of the executive branch breaching and abusing its power, interfering with justice and freedom of the press. Kudos to those calling them out! https://t.co/12EpzxCslh https://t.co/PdgdczPqN2
666	Thu Feb 28 15:25:17 +0000 2019	Με τον Πρωθυπουργό Μεντβέντεφ και τον Υπ. Εξωτερικών Λαβρόφ συζητήσαμε για το πώς θα μπορέσουμε να επεκτείνουμε τη δυνατότητά μας να προσελκύσουμε ξένες επενδύσεις από τη Ρωσία στην Ελλάδα, αλλά και το πώς θα βελτιώσουμε ταυτόχρονα την απόδοση των ελληνικών εξαγωγών στη Ρωσία. https://t.co/5huPv7uRiG
667	Thu Feb 28 15:19:54 +0000 2019	Συναντήθηκα σήμερα με τον Πρωθυπουργό κ. Μεντβέντεφ, τον Υπουργό Εξωτερικών κ. Λαβρόφ και τον Πρόεδρο της Ρωσικής Δούμας κ. Βολόντιν και συζητήσαμε πώς μπορούν να διευρυνθούν και να ενισχυθούν οι διμερείς σχέσεις μεταξύ Ελλάδας και Ρωσίας. https://t.co/qyGsl3LWCt https://t.co/QgjNpECBOf
668	Tue Feb 26 11:54:11 +0000 2019	Μόλις το 16% των σπιτιών είναι ασφαλισμένα έναντι φυσικών καταστροφών. Πρέπει να εξετάσουμε πώς κράτος και ιδιωτικός τομέας από κοινού θα παρέχουν φτηνή ασφάλιση σε περίπτωση σεισμού. Είναι αδιανόητο σε μια σεισμογενή χώρα να μην έχουμε στη διάθεσή μας ένα τέτοιο εργαλείο. https://t.co/StmS0Y516a
669	Tue Feb 26 11:53:14 +0000 2019	Σήμερα, η έννοια της αποταμίευσης είναι πολυτέλεια για τους πολλούς που αγωνίζονται καθημερινά να τα φέρουν βόλτα. Για να αποκτήσει ξανά η αποταμίευση τη σημασία της πρέπει να αυξηθεί το διαθέσιμο εισόδημα μέσα από την ανάπτυξη. Και να εφαρμοστούν πολιτικές που να τη στηρίζουν. https://t.co/Lfozfyl7ez
670	Tue Feb 26 11:50:31 +0000 2019	Μόνο η ανάπτυξη μπορεί να χρηματοδοτήσει ρεαλιστικά πρωτογενή πλεονάσματα, που δυστυχώς σήμερα βασίζονται σε μέτρα λιτότητας. Το τρίπτυχό μας είναι σαφές: Λιγότεροι φόροι και εισφορές, περισσότερες επενδύσεις για νέες δουλειές και κράτος στην υπηρεσία του πολίτη, όχι του κόμματος https://t.co/HwDexvfY1q
671	Mon Feb 25 17:25:50 +0000 2019	Η Κρήτη και η ιδιαίτερη πατρίδα μου τα Χανιά δοκιμάζονται πρωτόγνωρα από την ισχυρή κακοκαιρία. Ενημερώθηκα πριν λίγο από τον αντιπεριφερειάρχη Χανίων Απόστολο Βουλγαράκη για τις εκτεταμένες καταστροφές. Θα κάνω ό,τι περνά από το χέρι μου για να αντιμετωπιστούν το συντομότερο.
672	Sun Feb 24 09:14:21 +0000 2019	Με την Ιωάννα Μαρία Γκέρτσου συζητήσαμε πώς μπορούμε να κάνουμε καλύτερη τη ζωή των τυφλών συμπολιτών μας. Πώς θα τους εφοδιάσουμε με κάθε δυνατότητα που μεγιστοποιεί την ελευθερία τους και αυξάνει τις ευκαιρίες τους να είναι ανεξάρτητοι και δημιουργικοί. https://t.co/1lUHpkTPIX https://t.co/6l3CRuxL27
673	Sat Feb 23 12:48:28 +0000 2019	Το σύστημα υγείας που αξίζουμε είναι σύγχρονο, αποτελεσματικό και προσβάσιμο. Λειτουργεί και δεν ταλαιπωρεί. Σέβεται τον άνθρωπο και τις ανάγκες του. Μεριμνά για τους ευάλωτους. Προλαμβάνει την ασθένεια και προωθεί την καλή ποιότητα ζωής. Αυτό είναι το πρόγραμμά μας για την Υγεία https://t.co/VhlxjuXaGp
674	Sat Feb 23 10:48:34 +0000 2019	Ο καρκίνος είναι μια από τις μεγαλύτερες απειλές για την υγεία. Γι'αυτό το πρόγραμμά μας δίνει ιδιαίτερη έμφαση στην καταπολέμηση του καρκίνου, με ένα σχέδιο συνολικής αντιμετώπισής του, από την πρόληψη μέχρι τη θεραπεία, αλλά και παρακολούθηση και υποστήριξη σε όλα τα στάδια. https://t.co/VEq18bpK2d
675	Sat Feb 23 10:43:28 +0000 2019	Αναγνωρίζουμε την ανάγκη να υπάρχει ειδική μέριμνα για τις πιο ευάλωτες ομάδες. Για όσους έχουν μεγάλες δυσκολίες, για όσους έχουν την μεγαλύτερη ανάγκη, το κράτος θα παρέχει την ειδική φροντίδα που χρειάζονται. https://t.co/OtqiLiOBOL https://t.co/0YypKEggBz
676	Sat Feb 23 10:40:33 +0000 2019	Κατεύθυνση τρίτη, σύγχρονη και αποτελεσματική διοίκηση που θα περάσει επιτέλους στην ψηφιακή εποχή στις δομές και τις υπηρεσίες της ώστε να εξυπηρετεί και να μην ταλαιπωρεί τους πολίτες. Και που αξιολογείται για την ποιότητα και την αποτελεσματικότητά της. https://t.co/GJs0yWliSO https://t.co/4QqgleKA7F
677	Sat Feb 23 10:36:05 +0000 2019	Κατεύθυνση δεύτερη, η αξιοπρεπής περίθαλψη. Είναι καιρός να θέσουμε στο επίκεντρο της Υγείας τον άνθρωπο και να δημιουργήσουμε ένα σύστημα υγείας που σέβεται τους ασθενείς και δεν τους ταλαιπωρεί στις πιο ευάλωτες στιγμές της ζωής τους. https://t.co/d2M16pHsxL https://t.co/p7PyeNpleL
678	Sat Feb 23 10:23:57 +0000 2019	Κατεύθυνση πρώτη, η πρόληψη: Η Ελλάδα ξοδεύει μόλις 1,3% των δαπανών υγείας για πρόληψη, το χαμηλότερο ποσοστό στις αναπτυγμένες χώρες, ενώ ξέρουμε πως 30% των ασθενειών θα μπορούσαν να έχουν αποφευχθεί. Πρόληψη συνεπώς, σημαίνει υγεία για όλους. https://t.co/BPgmQQnODg https://t.co/QYdCyFDESi
679	Sat Feb 23 10:15:36 +0000 2019	Πέρασα δεκάδες ώρες μιλώντας με γιατρούς, νοσηλευτές, φυσιοθεραπευτές, διοικητικό προσωπικό. Κυρίως, όμως, ακούγοντας τους ίδιους τους ασθενείς. Μπορώ να σας βεβαιώσω λοιπόν ότι το Πρόγραμμά μας υπηρετεί πλήρως τον τίτλο του: Παρέχει Καλύτερη Δημόσια Υγεία σε όλους τους Έλληνες.
680	Fri Feb 22 18:12:11 +0000 2019	Έχουμε 144 καινούριους αναπληρωτές στις Γραμματείες μας με εξαιρετικά ποιοτικά στοιχεία. Είμαι περήφανος που κάνουμε πράξη την ουσιαστική ποιοτική ανανέωση της Νέας Δημοκρατίας και δίνουμε ευκαιρίες σε νέους ανθρώπους να ασχοληθούν με τα κοινά. https://t.co/16PWlrMEcq https://t.co/M5A79DHfDU
681	Fri Feb 22 13:57:17 +0000 2019	Θέλουμε μια Ελλάδα με λιγότερους φόρους, με περισσότερες και καλύτερες δουλειές, με ευκαιρίες για όλους τους Έλληνες. Η μεσαία τάξη θα σταθεί και πάλι στα πόδια της. Πιστέψτε το: δεν είμαστε καταδικασμένοι να ζούμε στη μιζέρια. Αξίζουμε και μπορούμε πολύ καλύτερα. https://t.co/y3l9kyuwv2
682	Thu Feb 21 15:12:12 +0000 2019	Δεν μπορούμε να παριστάνουμε πως δεν βλέπουμε το πρόβλημα της ανεξέλεγκτης χρήσης ναρκωτικών. Πρέπει να το συζητήσουμε χωρίς προκαταλήψεις. Η πρόταση για ελεγχόμενους χώρους χρήσης ναρκωτικών είναι μια πρωτοβουλία για την οποία επί της αρχής είμαι θετικός. https://t.co/nd3zz6Bkhs https://t.co/8x4AfZIeer
683	Thu Feb 21 14:19:29 +0000 2019	Ο κ. Τσακαλώτος, όντως, δεν μας έχρισε ακόμη κυβέρνηση. Θέλω, ωστόσο, να τον ευχαριστήσω προσωπικά. Διότι παραδέχθηκε επιτέλους ότι τα πλεονάσματά του καταστρέφουν την οικονομία και δεσμεύθηκε ο ΣΥΡΙΖΑ να στηρίξει την προσπάθεια που καταβάλλω εδώ και 3 χρόνια για να τα μειώσω.
684	Thu Feb 21 09:16:36 +0000 2019	Χαίρομαι ειλικρινά που η Ελληνική Ένωση Τραπεζών &amp; ο πρόεδρός της @karamouzisn αντιμετωπίζουν θετικά την πρότασή μου να επιβραβευθούν και οι συνεπείς δανειολήπτες στη ρύθμιση για την προστασία της α' κατοικίας. Είναι δίκαιη πρόταση και η κυβέρνηση οφείλει να την υιοθετήσει άμεσα. https://t.co/Vu9voOXZHd
685	Wed Feb 20 19:04:48 +0000 2019	Η Νέα Δημοκρατία είναι κοντά στην κοινωνία. Και μέσα από μια σειρά κοινωφελών δράσεων στεκόμαστε δίπλα σε αυτούς που έχουν πραγματικά ανάγκη. Διότι εμείς είμαστε το πραγματικά λαϊκό κόμμα. Είναι εύκολο να λες στα λόγια πως είσαι κοντά στο λαό, αλλά αυτό αποδεικνύεται στην πράξη. https://t.co/KyBoDatptR
686	Wed Feb 20 19:01:32 +0000 2019	Κοινωνική δικαιοσύνη σημαίνει ένα φτωχό παιδί να έχει πρόσβαση σε ένα καλό δημόσιο σχολείο και πανεπιστήμιο που θα του δώσει εφόδια. Ενα δημόσιο σύστημα υγείας που φροντίζει τους πιο αδύναμους. Και ναι, σημαίνει οι πολίτες να μην αισθάνονται ανασφάλεια στις γειτονιές τους. https://t.co/6J8S4ADub7
687	Wed Feb 20 18:44:49 +0000 2019	"Θέλουμε να ""μεγαλώσουμε την πίτα"". Γι' αυτό τονίζουμε τη σημασία της ανάπτυξης, των επενδύσεων, των νέων θέσεων εργασίας. Αλλά θέλουμε αυτή η πίτα να μοιραστεί σε όλους. Γι'αυτό μιλάμε πρωτίστως για τους εργαζόμενους, οι οποίοι θα έχουν πραγματικό όφελος από την πολιτική μας. https://t.co/kC4Jnc6Lb2"
688	Wed Feb 20 14:43:18 +0000 2019	Η ανανέωση των ψηφοδελτίων μας ήταν από την αρχή προσωπικό μου στοίχημα. Σήμερα παρουσιάζουμε 15 νέους υποψήφιους Ευρωβουλευτές. Έχουν σημαντική επαγγελματική και κοινωνική διαδρομή και διεκδικούν για πρώτη φορά ψήφο με τη Νέα Δημοκρατία. Γνωρίστε τους! https://t.co/AZS6EUkE7Q
689	Wed Feb 20 13:14:14 +0000 2019	Στον 1ο μήνα της διακυβέρνησής μας θα μειώσουμε τους φόρους. Σε 12 μήνες θα επαναδιαπραγματευτούμε το πρωτογενές πλεόνασμα &amp; το 80% από τη μείωσή του θα διοχετευθεί σε ακόμα μεγαλύτερη μείωση φόρων. Έτσι θα απελευθερώσουμε την οικονομία ενισχύοντας παράλληλα την κοινωνική συνοχή. https://t.co/m5LleDlqH6
