	created_at	full_text
1330	Thu May 03 15:37:14 +0000 2018	Το Δημόσιο δεν έχει να φοβάται τίποτα από τη συνεργασία του με τον ιδιωτικό τομέα. Έχει μόνον να κερδίσει, όπως και οι πολίτες που θα απολαμβάνουν καλύτερες &amp; φθηνότερες υπηρεσίες. Αποδείχθηκε με τα 24 σχολεία στην Αττική και στην διαχείριση απορριμάτων σε Ήπειρο &amp; Δυτ. Μακεδονία
1331	Thu May 03 15:34:30 +0000 2018	Η αξιολόγηση είναι αίτημα των δημοσίων υπαλλήλων. Το μοντέλο μας θα είναι διάφανο και απολύτως αξιοκρατικό. Όσοι λαμβάνουν υψηλή βαθμολογία θα επιβραβεύονται ιεραρχικά και μισθολογικά. Όσοι υστερούν, θα καταρτίζονται για να βελτιωθούν ή θα μετακινούνται σε άλλες θέσεις.
1332	Thu May 03 15:32:30 +0000 2018	Το κομματικό κράτος του ΣΥΡΙΖΑ θα ξηλωθεί. Όταν η πραγματική οικονομία στενάζει δεν νοείται το μισθολογικό κόστος στο Δημόσιο να έχει αυξηθεί κατά 612 εκατομμύρια ευρώ την τελευταία τριετία.
1333	Thu May 03 15:28:55 +0000 2018	Οι δημόσιοι υπάλληλοι πρέπει να νιώθουν ασφαλείς. Δεν θα γίνουν απολύσεις. Όμως ο κανόνας 1 πρόσληψη για κάθε 5 αποχωρήσεις θα εφαρμοσθεί. Οι προσλήψεις δεν θα γίνονται άκριτα όπως σήμερα, αλλά με συγκροτημένο σχέδιο. Είναι αδιανόητο να πλεονάζουν γιατροί &amp; να λείπουν νοσηλευτές.
1334	Thu May 03 15:24:32 +0000 2018	Θεωρώ τη μεταρρύθμιση στο Δημόσιο κεντρικό μοχλό για την ανάπτυξη και την επανεκκίνηση της οικονομίας. Αποκλειστική του αποστολή είναι η καλύτερη και γρηγορότερη εξυπηρέτηση του πολίτη. https://t.co/uKwLy3wQ6z
1335	Wed May 02 16:10:34 +0000 2018	Κοινωνική πολιτική δεν υπάρχει χωρίς στήριξη της οικογένειας. Κανένα παιδί δεν θα μένει εκτός παιδικού σταθμού και το αφορολόγητο θα αυξάνεται κατά 1000 ευρώ για κάθε παιδί.
1336	Wed May 02 16:03:52 +0000 2018	Σήμερα μόλις 12 στους 100 ανέργους λαμβάνουν επίδομα ανεργίας. Η Νέα Δημοκρατία θα ελαστικοποιήσει τα κριτήρια για να το παίρνουν περισσότεροι συμπολίτες μας και θα αυξήσει το συνολικό ποσό κατά 200 εκατομμύρια ευρώ.
1337	Wed May 02 16:01:09 +0000 2018	Θα διαθέσουμε €1 δις για να πάρουν το ελάχιστο εγγυημένο εισόδημα περισσότεροι από 800.000 συμπολίτες μας. Και θα τους προσφέρουμε τη δυνατότητα μικρών δανείων, όπως έκανε και η Γαλλία, ώστε να δημιουργηθούν νέες μικρές επιχειρήσεις από ανθρώπους που βρίσκονται στο περιθώριο.
1338	Wed May 02 15:53:39 +0000 2018	Με το σχέδιό μας η χώρα θα πετύχει ρυθμούς ανάπτυξης 4%. Μέχρι το 2021 θα δημιουργηθούν 600.000 νέες θέσεις εργασίας και η ανεργία θα υποχωρήσει κατά 7%. Αυτή είναι η απάντησή μας στην ακραία φτώχεια.
1339	Tue May 01 10:17:28 +0000 2018	Η Πρωτομαγιά συμβολίζει τον διαχρονικό αγώνα των εργαζομένων για καλύτερες συνθήκες εργασίας και αξιοπρεπείς αμοιβές. Σήμερα ο αγώνας αυτός είναι και ο σημαντικότερος στόχος μου. Περισσότερες &amp; καλύτερες δουλειές με μείωση φόρων και προσέλκυση επενδύσεων. https://t.co/K1m0p5DLf1
1340	Fri Apr 27 10:28:59 +0000 2018	Απαντάμε στην προπαγάνδα του Μαξίμου και στο παραμύθι του δήθεν τέλους των μνημονίων. https://t.co/41HQ1K1PnJ
1341	Fri Apr 27 10:02:00 +0000 2018	Αυτή η κυβέρνηση είναι επικίνδυνη. Και την προειδοποιώ επιτέλους να σοβαρευτεί έστω στα εθνικά θέματα. Διότι θα είναι εγκληματικό να επαναλάβει στην εξωτερική πολιτική της χώρας τη ζημία που προκάλεσε στην εθνική οικονομία.
1342	Fri Apr 27 09:51:48 +0000 2018	Η κυβέρνηση κλείνει τα μάτια μπροστά στην απίστευτη αδιαφάνεια στη διαχείριση εκατοντάδων εκατ. ευρώ. “Follow the money” που θα έλεγε και ο κ. Κριμιζής, που παραιτήθηκε προχθές καταγγέλλοντας τον αδιαφανή τρόπο λειτουργίας του #ΕΛΔΟ &amp; περιγράφοντας μια παράγκα του διαστήματος.
1343	Fri Apr 27 09:44:54 +0000 2018	Η κυβέρνηση επικαλείται ληγμένα ιδεολογήματα περί ταξικής πάλης. Η πολιτική της, όμως, στρέφεται εναντίον όλων. Ματώνει ζωές στο Ζεφύρι ή στην Κηφισιά. Ενώνει ποινικούς &amp; τρομοκράτες, κλέφτες &amp; κουκουλοφόρους, Εξομοιώνει τα στενά των Εξαρχείων με τα προαύλια των πανεπιστημίων.
1344	Fri Apr 27 09:35:12 +0000 2018	Τα υπερπλεονάσματα ήρθαν από την υπερφορολόγηση και τη δραματική μείωση συντάξεων και κοινωνικών επιδομάτων και όχι από την υπεραπόδοση της οικονομίας. Τα υπερπλεονάσματα που γονατίζουν τους Έλληνες και σκοτώνουν την ανάπτυξη δεν είναι αφορμή για πανηγυρισμούς.
1345	Fri Apr 27 09:33:55 +0000 2018	Η ρύθμιση χρέους πρέπει να είναι οριστική. Αυτόματη. Χωρίς νέες δεσμεύσεις &amp; προαπαιτούμενα. Το είπα χθες και στον κ. Γιούνκερ. Χρειάζεται οριστική &amp; αμετάκλητη ρύθμιση. Οτιδήποτε άλλο θα συνιστά υπαναχώρηση έναντι της συμφωνίας του Νοεμβρίου του 2012 που πέτυχε η τότε κυβέρνηση.
1346	Fri Apr 27 09:30:07 +0000 2018	Θυμίζω ότι αυτή η κυβέρνηση υποσχόταν ότι θα διαγράψει μονομερώς το χρέος. Ακολούθως ότι θα το κουρέψει. Μετά ότι θα το ρυθμίσει. Τελικά πέρασαν 4 χρόνια και δεν έκανε τίποτα και το χρέος παραμένει κοντά στο 180% του ΑΕΠ, δηλαδή 60% του ΑΕΠ υψηλότερο από όταν μπήκαμε στα Μνημόνια
1347	Fri Apr 27 09:25:45 +0000 2018	Όλοι μαζί, νέοι και μεγαλύτεροι, εργαζόμενοι και άνεργοι, πληρώνουμε, εδώ και 4 χρόνια, ΦΠΑ που οι ΣΥΡΙΖΑ-ΑΝΕΛ αύξησαν παντού: από τα καύσιμα &amp; τις συγκοινωνίες, ως τα τρόφιμα &amp; τα τηλεφωνήματα. Όλα αυτά χάριν της δημοσιονομικής φούσκας των «πλεονασμάτων» &amp; της  «καθαρής εξόδου».
1348	Fri Apr 27 09:22:16 +0000 2018	Η μισή Ελλάδα, οφείλει στην εφορία και τα ασφαλιστικά ταμεία. Οι άνεργοι περιμένουν να βρουν δουλειά, ενώ οι νέοι εξακολουθούν να καταφεύγουν στο εξωτερικό. Οι συνταξιούχοι αγωνιούν για τις νέες περικοπές. Οι επιχειρηματίες περιμένουν ματαίως να βγούμε από τα capital controls.
1349	Fri Apr 27 06:14:21 +0000 2018	Μακάρι να τολμούσε και ο κ. Τσίπρας να έρθει να περπατήσουμε μαζί σε μια λαϊκή αγορά. Αλλά βλέπετε ότι δεν βγαίνει από το Μαξίμου γιατί δεν τολμάει να αντιπαρατεθεί με την σκληρή πραγματικότητα που βιώνετε κάθε μέρα. https://t.co/ypmu7w1SYW https://t.co/VKNqgwRnxW
1350	Wed Apr 25 12:24:52 +0000 2018	"RT @ChristosDimas_: Ίδιο ερώτημα. Διαφορετικές απαντήσεις και νοοτροπίες. 
Τα συμπεράσματα δικά σας! 
@atsipras VS @kmitsotakis
 
#ependyse…"
1351	Wed Apr 25 11:46:51 +0000 2018	RT @neademokratia: Aντί να ζητάτε συγνώμη για την απαξίωση της ΔΕΗ, συνεχίζετε να λέτε ψέματα. https://t.co/VIxu8erbXW
1352	Wed Apr 25 10:13:10 +0000 2018	Eθνικός Ενεργειακός Σχεδιασμός. https://t.co/HfgBYRLDGd
1353	Wed Apr 25 08:48:00 +0000 2018	Σας το λέμε εμείς, που πιστεύουμε στην ελεύθερη οικονομία και στις επενδύσεις: Αν είναι να τις κάνετε έτσι, τότε μην κάνετε ιδιωτικοποιήσεις! Όχι άλλες ιδιωτικοποιήσεις αλά ΣΥΡΙΖΑ, κ. Τσίπρα! #vouli
1354	Wed Apr 25 08:37:00 +0000 2018	Πολεμήσατε το έργο της ηλεκτρικής διασύνδεσης Κυκλάδων-ηπειρωτικής Ελλάδας, καθυστερήσατε και τελικά ζημιώσατε τους καταναλωτές με επιπλέον 150 εκατ. ευρώ. Όμως κόψατε την κορδέλα. Σε αυτό έχετε γίνει πρώτοι. Να κόβετε κορδέλες σε έργα που άλλοι υλοποίησαν ενώ τους συκοφαντούσατε
1355	Wed Apr 25 08:32:13 +0000 2018	Υλοποιώντας την πολιτική «δεν πληρώνω» του κ. Τσίπρα οι ληξιπρόθεσμες οφειλές προς τη ΔΕΗ εκτινάχθηκαν από το 1 δισ. ευρώ το καλοκαίρι του 2014, στα περίπου 3 δισ. σήμερα. Η χρηματιστηριακή αξία της ΔΕΗ γκρεμίστηκε κατά 80%, από 2,5 δισ. το 2014, σε 0,6 δισ. ευρώ σήμερα. #vouli
1356	Wed Apr 25 08:26:49 +0000 2018	Αν έπρεπε να σας περιγράψω με μια πρόταση θα έλεγα μόνο: Ψεύτες και λαϊκιστές τότε, αδίστακτοι και δημαγωγοί τώρα, αδιόρθωτοι και ανεπαρκείς πάντα. #vouli
1357	Wed Apr 25 08:23:29 +0000 2018	Το νομοσχέδιο για τη ΔΕΗ αποτελεί την ταυτότητα της κυβέρνησης: Στο ονοματεπώνυμο γράφει Τσίπρας-Καμμένος. Στα χαρακτηριστικά, Ψέμα-Λαϊκισμός-Τυχοδιωκτισμός. Και στη φωτογραφία της, έχει τα δικά σας πρόσωπα, βουλευτές των ΣΥΡΙΖΑΝΕΛ. #vouli
1358	Wed Apr 25 08:19:54 +0000 2018	Eίναι πρωτοφανές αλλά να λέει ο κ Τσίπρας, άλλα ο κ. Καμμένος, κι άλλα ο κ. Κουβέλης. Δεν μπορώ να φανταστώ ότι ο πρωθυπουργός στην συνομιλία του με τον κ. Μακρόν χάθηκε ξανά στη μετάφραση. θα πρέπει να καταλάβετε ότι η εξωτερική πολιτική και η άμυνα της χώρας δεν είναι παιχνίδι.
1359	Tue Apr 24 15:40:51 +0000 2018	Η Κική Τσακαλδήμη κατακτά κορυφές κατά κυριολεξία. Έθεσε ως στόχο να ανέβει στο Έβερεστ και τα κατάφερε. «Αν θέλεις, μπορείς», μου είπε και σκέφτηκα ότι σε αυτή τη φράση βρίσκεται τελικά το στοίχημα για ολόκληρη τη χώρα μας, φτάνει να το πιστέψουμε. https://t.co/BKAaoednkP https://t.co/Uw8Lnjclju
1360	Tue Apr 24 14:47:57 +0000 2018	O Άγγελος Δεληβοριάς σφράγισε με την παρουσία του την πολιτιστική ζωή του τόπου μας. Με την οξυδέρκειά του δημιούργησε έναν πρωτοποριακό φορέα πολιτιστικής δράσης, το Μουσείο Μπενάκη, αφήνοντας πίσω του μια λαμπρή παρακαταθήκη. Στους οικείους του, τα πιο θερμά μου συλλυπητήρια.
1361	Tue Apr 24 08:58:10 +0000 2018	Έχουμε μιλήσει για νέο ασφαλιστικό τριών πυλώνων με ανώτατο όριο φορολογικών &amp; ασφαλιστικών εισφορών που δεν θα ξεπερνάει το 50%. Μεγαλύτερη συμμετοχή του ιδιωτικού τομέα, στον 3o αλλά και στον 2o πυλώνα, θα δημιουργήσει τα κεφάλαια που θα επανεπενδυθούν στη χώρα μας. #SEV4Growth
1362	Tue Apr 24 08:29:21 +0000 2018	Μόνο η ΝΔ έχει ξεκάθαρο σχέδιο προσέλκυσης επενδύσεων. Θα μειώσουμε τη φορολογία, θα δώσουμε κίνητρα για επενδύσεις, θα απλοποιήσουμε τη γραφειοκρατία και περιμένουμε από εσάς να επενδύσετε, να πληρώνετε τους φόρους σας, να σέβεστε τους εργαζόμενους &amp; να φροντίζετε το περιβάλλον.
1363	Tue Apr 24 08:19:22 +0000 2018	Η βιομηχανία χρειάζεται φορολογικά κίνητρα για επενδύσεις σε πάγια κεφάλαια. Χρειάζεται διευκόλυνση στην αδειοδότηση, συγκέντρωση της μεταποιητικής δραστηριότητας σε οργανωμένους χώρους και παρεμβάσεις στην αγορά ενέργειας ώστε να μειωθεί το κόστος της. #SEV4Growth
1364	Tue Apr 24 08:04:43 +0000 2018	Ο εύκολος διαχωρισμός μεταξύ κακού κεφαλαίου και καλού εργαζόμενου, πάνω στον οποίον πάτησαν οι ιδεολογικές διαφοροποιήσεις τον 20ο αιώνα, σήμερα έχει ξεπεραστεί. Οι καλές επιχειρήσεις δημιουργούν καλές θέσεις απασχόλησης με πρόσθετα κίνητρα για να προσελκύσουν τα καλά στελέχη.
1365	Tue Apr 24 07:56:14 +0000 2018	Η χώρα χρειάζεται μια αποφασισμένη και αποτελεσματική κυβέρνηση και μια κρατική διοίκηση που θα θέτει την προσέλκυση επενδύσεων ως πρώτη πολιτική προτεραιότητα. Αυτό μπορεί να ακούγεται αυτονόητο, αλλά δεν το έχω ακούσει ποτέ από τη σημερινή κυβέρνηση. #SEV4growth
1366	Tue Apr 24 07:52:21 +0000 2018	Επενδύσεις σημαίνει περισσότερες και καλύτερες θέσεις εργασίας με υψηλότερους μισθούς, καλύτερες απολαβές και καλύτερο πλαίσιο εργασιακής κάλυψης. Θέλουμε τις επενδύσεις για να αποκλιμακώσουμε την ανεργία και να δώσουμε ευκαιρίες στα νέα παιδιά. #SEV4Growth
1367	Mon Apr 23 08:34:06 +0000 2018	Εδώ, από την 114 Πτέρυγα Μάχης στην Τανάγρα και από την 331 Μοίρα, στην οποία υπηρετούσε ο ήρωας Σμηναγός Γιώργος Μπαλταδώρος, στέλνουμε ένα ισχυρό μήνυμα: Η αποτρεπτική δύναμη των Ενόπλων Δυνάμεων παραμένει ισχυρή και το ηθικό των Ενόπλων Δυνάμεων παραμένει ακμαίο. https://t.co/LpKMlQI3bh
1368	Sun Apr 22 15:55:22 +0000 2018	Νέα επίθεση του Ρουβίκωνα στην γαλλική πρεσβεία ακριβώς απέναντι στη Βουλή. Η χώρα διασύρεται διεθνώς από μια ανίκανη κυβέρνηση που δεν θέλει ή -ακόμη χειρότερα- δεν μπορεί να συλλάβει μια φράξια τάχα αντιεξουσιαστών. Πάλι έφυγαν σαν κύριοι...
1369	Sun Apr 22 12:31:48 +0000 2018	Η βιώσιμη ανάπτυξη είναι μια θεματολογία που μας αφορά όλους. Είτε μιλάμε για την προστασία του περιβάλλοντος, είτε μιλάμε για την κοινωνική Δικαιοσύνη, είτε μιλάμε για την ισότητα των φύλων, είτε μιλάμε για την προστασία των θαλασσών μας. #Elpidos2030 https://t.co/xTgpnW5oxx
1370	Sat Apr 21 14:34:58 +0000 2018	Επισκέφθηκα στα Μέγαρα μια σειρά από δυναμικές επιχειρήσεις του πρωτογενούς τομέα ο οποίος αποτελεί συγκριτικό πλεονέκτημα για τη χώρα μας. Θα στηριχθεί από τη ΝΔ με στοχευμένα φορολογικά κίνητρα και αποδέσμευση πόρων που λιμνάζουν λόγω της ανικανότητας της σημερινής Κυβέρνησης. https://t.co/cXjEXKx1bw
1371	Fri Apr 20 13:37:34 +0000 2018	RT @neademokratia: Ο θάνατος του Αλέξανδρου Σταματιάδη, που πυροβολήθηκε εν ψυχρώ από ληστές μέσα στο σπίτι του, συγκλονίζει κάθε πολίτη. Η…
1372	Thu Apr 19 08:32:38 +0000 2018	Είμαστε έτοιμοι να βάλουμε τέλος στη μιζέρια και στο τέλμα που κυριαρχούν στη χώρα μας. Είμαστε έτοιμοι να ενώσουμε τους Έλληνες και να βάλουμε τέλος σε άγονους διχασμούς. Όσο κι αν η κυβέρνηση δεν το αντέχει ψυχολογικά, η ώρα της πολιτικής αλλαγής πλησιάζει.
1373	Thu Apr 19 08:31:07 +0000 2018	Για μας η αυτοδιοίκηση είναι θεσμικός εταίρος, συνομιλητής και συνεργάτης. Πιστεύουμε στις δυνατότητές της. Την εμπιστευόμαστε στην πράξη και όχι στα λόγια. Ενώ για τον ΣΥΡΙΖΑ η αυτοδιοίκηση είναι πολιτικό όργανο προς εξαγορά και εκμαυλισμό.
1374	Thu Apr 19 08:27:44 +0000 2018	Οι παρεμβάσεις μας θα θέσουν τις βάσεις για την πιο τολμηρή μεταρρύθμιση που αφορά την οργάνωση του κράτους. Την πλήρη απελευθέρωση της τοπικής αυτοδιοίκησης μέσα από τη θεσμοθέτηση της οικονομικής της ανεξαρτησίας. Δηλαδή την πραγματική δημοσιονομική αποκέντρωση.
1375	Thu Apr 19 08:16:27 +0000 2018	Αξιοποιούμε με μια νέα λογική όλα τα σύγχρονα χρηματοδοτικά εργαλεία, στηρίζοντας ενεργά και αποφασιστικά τις συμπράξεις δημοσίου &amp; ιδιωτικού τομέα. Και αν η συνεργασία με τον ιδιωτικό τομέα οδηγεί στην παροχή καλύτερων υπηρεσιών με χαμηλότερο κόστος, αυτό πρέπει να ενθαρρύνεται.
1376	Thu Apr 19 08:11:49 +0000 2018	Επανεξετάζουμε συνολικά την λειτουργία των αποκεντρωμένων διοικήσεων και τη μεταφορά από το κεντρικό κράτος ζωτικών αρμοδιοτήτων. Η σημερινή αποκεντρωμένη διοίκηση, μέχρι να αλλάξει το Σύνταγμα, θα διατηρήσει μόνο τις απολύτως προβλεπόμενες, από το Σύνταγμα, αρμοδιότητες.
1377	Thu Apr 19 08:06:20 +0000 2018	Η νομοθεσία παραμένει κατακερματισμένη, αρμοδιότητες και γραφειοκρατία ταλανίζουν τη σχέση κράτους-δήμων-περιφερειών, ενώ το ανθρώπινο δυναμικό χρειάζεται αναβάθμιση. Αυτά τα προβλήματα αντιμετωπίζονται με μικρότερο, επιτελικό κράτος και με ισχυρότερους δήμους και περιφέρειες.
1378	Thu Apr 19 08:02:33 +0000 2018	Ο μεγάλος ασθενής στην πατρίδα μας είναι το ίδιο το ελληνικό κράτος. Ένα κράτος γραφειοκρατικό, αρτηριοσκληρωτικό, γερασμένο και σκουριασμένο που αδικεί όλους τους Έλληνες και τις Ελληνίδες. Σχεδιάζουμε ακόμα με όρους του 19ου αιώνα και υλοποιούμε με εργαλεία από τα μέσα του 20ου
1379	Thu Apr 19 07:58:17 +0000 2018	Με τις κάλπες και τα εκλογικά συστήματα παίζει μόνο όποιος φοβάται την ετυμηγορία του λαού. Ούτε εγώ, αλλά ούτε και οι καλοί αυτοδιοικητικοί που τιμούν τις θέσεις τους έχουν τέτοιες ανησυχίες. Μόνο ο κ. Τσίπρας…
1380	Thu Apr 19 07:55:58 +0000 2018	O πραγματικός στόχος της κυβέρνησης είναι να πάρει το Υπουργείο Εσωτερικών τον έλεγχο των Δήμων και των Περιφερειών, τα συλλογικά όργανα των οποίων δεν θα μπορούν να λάβουν αποφάσεις. O σκοπός της κυβέρνησης είναι να πληγεί το συνταγματικά κατοχυρωμένο αυτοδιοίκητο. Αυτό θέλουν.
1381	Thu Apr 19 07:53:58 +0000 2018	Οι αυτοδιοικητικές εκλογές δεν θα γίνουν με απλή αναλογική, ώστε να διαλυθεί το βασικό δημοκρατικό κύτταρο της κοινωνίας. Θα γίνουν με τον σημερινό εκλογικό νόμο και με κυβέρνηση Νέας Δημοκρατίας. Θα το ξαναπώ: Όχι άλλα παιχνίδια με τους θεσμούς.
1382	Thu Apr 19 07:53:09 +0000 2018	H κυβέρνηση θέλει να σας χρησιμοποιήσει για τα σχέδιά της. Και επειδή ξέρει ότι στην Τοπική Αυτοδιοίκηση ερείσματα δεν έχει, επιδιώκει να προκαλέσει την μεγαλύτερη δυνατή αναστάτωση, αλλοιώνοντας το εκλογικό σύστημα και παίζοντας με το χρόνο των εκλογών.
1383	Thu Apr 19 07:49:23 +0000 2018	Για μένα και για τη Νέα Δημοκρατία δεν υπάρχουν «μπλε», «ροζ», «πράσινοι» ή «κόκκινοι» αυτοδιοικητικοί. Δεν υπάρχουν χρώματα, όπως δεν υπάρχουν και διαχωριστικές γραμμές. Διαχωριστική γραμμή υπάρχει μόνο με το παρελθόν, στο οποίο δεν θα γυρίσουμε ποτέ πίσω.
