	created_at	full_text
2018	Mon Sep 25 11:42:50 +0000 2017	Είχε ο κ. Τσίπρας προηγούμενη ενημέρωση από τον κ. Καμμένο για την επαφή του με τον ισοβίτη; Έχει γνώση του τι ειπώθηκε μεταξύ τους; #vouli
2019	Mon Sep 25 11:42:15 +0000 2017	Είναι μονόδρομος αν θέλουμε να μάθουμε την αλήθεια να στηρίξετε την πρόταση μας &amp; να μην αφήσετε αυτήν τη σκιά πάνω στον υπουργό σας. #vouli https://t.co/hO4peMmP7s
2020	Mon Sep 25 11:38:44 +0000 2017	Είμαστε κοντά στη Δικαιοσύνη με το να είμαστε μακριά της. Με το να αφήνουμε τους δικαστές απερίσπαστους να κάνουν τη δουλειά τους. #vouli
2021	Mon Sep 25 11:36:22 +0000 2017	Κατασκευάζετε fake news &amp; ψεύτικες δημοσκοπήσεις στα υπόγεια του Μαξίμου &amp; τις διακινείτε μέσω παρασυστήματος που τρέφεται με κρατικό χρήμα.
2022	Mon Sep 25 11:35:11 +0000 2017	Η κυβερνητική πλειοψηφία έχει τοποθετηθεί απέναντι στο αυτονόητο. Προτιμά τη συσκότιση από τη διερεύνηση. #vouli https://t.co/L3fHNLKpaU
2023	Mon Sep 25 11:34:16 +0000 2017	Ζητάμε να μπουν οι προβλέψεις του Συντάγματος μπροστά και πάνω από τις πολιτικές σκοπιμότητες. #vouli
2024	Mon Sep 25 11:32:01 +0000 2017	Ζωντανά τώρα στο βήμα της Βουλής στη συζήτηση για τη σύσταση Εξεταστικής Επιτροπής για τον Π. Καμμένο.  #vouli https://t.co/fqFuXo5nF4
2025	Mon Sep 25 08:51:08 +0000 2017	Η νίκη της Α.Merkel ανοίγει παράθυρο ευκαιρίας για τολμηρές αλλαγές στην Ευρώπη για τη ζωή &amp; την ασφάλεια των πολλών.https://t.co/1HqTnPOUIk
2026	Fri Sep 22 11:14:25 +0000 2017	Η μεγάλη διαφορά στα σχολεία μας γίνεται από τους καλούς δασκάλους &amp; καθηγητές. Έχουμε υποχρέωση να τους στηρίξουμε. https://t.co/f794NMCfoC https://t.co/0fDUplRDIP
2027	Fri Sep 22 07:32:07 +0000 2017	"Φοβάται να κουνήσει τον ψεύτη κ. Κουρουμπλή από την καρέκλα του, αλλά θα ""κινήσει τον τροχό της ιστορίας προς τα μπρος""...
Ουδέν σχόλιο."
2028	Thu Sep 21 16:49:55 +0000 2017	Με ψαράδες νωρίτερα στο Κερατσίνι, όχι για αντιπολίτευση πάνω στην πετρελαιοκηλίδα, αλλά για όσα πρέπει να γίνουν. https://t.co/LTS6R7w2n7 https://t.co/dHlbmDSQCj
2029	Thu Sep 21 12:17:47 +0000 2017	Χαιρετίζω την παραμονή της Eldorado &amp; ρωτώ: Γιατί χρειάστηκε τόσος χαμένος χρόνος, διεθνής διασυρμός &amp; πιέσεις για να γίνουν τα αυτονόητα;
2030	Wed Sep 20 09:10:41 +0000 2017	Κατανοώ απόλυτα τον εκνευρισμό του κ.Κουρουμπλή, ο οποίος θα έπρεπε ήδη να είχε παραιτηθεί αν είχε τη στοιχειώδη πολιτική αξιοπρέπεια.#vouli
2031	Wed Sep 20 09:01:07 +0000 2017	Γιατί καθυστερήσατε 4 μέρες να ζητήσετε τη βοήθεια του EMSA; Μεταξύ του κ. Κουρουμπλή και του EMSA, πιστεύω τον EMSA. #vouli
2032	Wed Sep 20 08:56:39 +0000 2017	Τι εξηγήσεις έχετε να δώσετε για το γεγονός ότι ένα πλοίο το οποίο ξεκάθαρα δεν έπρεπε να πλέει κρίθηκε αξιόπλοο από το υπουργείο σας;#vouli
2033	Wed Sep 20 08:50:29 +0000 2017	Ζωντανά τώρα στην Επιτροπή Περιβάλλοντος της Βουλής για την αντιμετώπιση της θαλάσσιας ρύπανσης στον Σαρωνικό. https://t.co/kYwGFFv2Fn
2034	Tue Sep 19 17:16:43 +0000 2017	Οι Έλληνες αξίζουμε καλύτερα. https://t.co/c0SFEuBiV7
2035	Mon Sep 18 13:14:18 +0000 2017	"RT @EuroAthletics: RT to vote for Ekaterini Stefanidi as your female European Athlete of the Year!

Stefanidi cleared a 4.91m WL for the wo…"
2036	Sun Sep 17 12:18:21 +0000 2017	Όσο πιο γρήγορα γίνουν οι εκλογές, τόσο το καλύτερο για τη χώρα. Αγωνίζομαι να πείσω τους συμπολίτες μας πως οι Έλληνες #Αξίζουμε_καλύτερα.
2037	Sun Sep 17 12:14:23 +0000 2017	Δεν είναι πρόθεσή μου να κάνω αντιπολίτευση καίγοντας την Αθήνα. Θέλω οι πολίτες να πιστέψουν ότι θα εφαρμόσω όλα όσα υπόσχομαι. #ΔΕΘ2017
2038	Sun Sep 17 12:13:46 +0000 2017	Η ασφάλεια αφορά κυρίως τους λιγότερο προνομιούχους. Δεν είναι ούτε δεξιά, ούτε αριστερή. Είναι στον πυρήνα των υποχρεώσεων του κράτους.
2039	Sun Sep 17 12:08:56 +0000 2017	".@troupnet - Υπάρχει περίπτωση συνεργασίας με τους ΑΝΕΛ;
.@kmitsotakis - Όχι."
2040	Sun Sep 17 12:03:59 +0000 2017	.@g_evgenidis Ας συγκρίνει ο καθένας τη χθεσινή μου ομιλία με αυτή του κ. Τσίπρα, και ας κρίνει ποιον εμπιστεύεται περισσότερο. #ΔΕΘ2017
2041	Sun Sep 17 11:59:26 +0000 2017	Βλέπω συνεχώς νέους ανθρώπους που θέλουν να μπουν στην πολιτική και τα ψηφοδέλτιά μας. Οι πόρτες μας είναι ανοιχτές. #ΔΕΘ2017
2042	Sun Sep 17 11:56:48 +0000 2017	Θέλω ένα κράτος που θα κάνει λιγότερα &amp; καλύτερα. Θέλω εισαγωγικό φορολογικό συντελεστή στο 9% &amp; 1000 ευρώ αφορολόγητο για κάθε παιδί.
2043	Sun Sep 17 11:46:34 +0000 2017	.@christina_korai Ο κ. Καμμένος θα πρέπει να εξηγήσει στη Βουλή &amp; τον Ελληνικό λαό, για ποιό λόγο συνομιλούσε με έναν καταδικασμένο ισοβίτη.
2044	Sun Sep 17 11:43:27 +0000 2017	Θα είμαστε πολύ αυστηροί με επιχειρήσεις που δεν σέβονται τους εργαζομένους τους και το περιβάλλον. #ΔΕΘ2017 #Αξίζουμε_καλύτερα
2045	Sun Sep 17 11:38:08 +0000 2017	Συνεργατικά σχήματα που θα προωθηθούν μέσω φορολογικών κινήτρων, εκπαίδευση και αξιοποίηση νέων τεχνολογιών για τους αγρότες μας. #ΔΕΘ2017
2046	Sun Sep 17 11:35:55 +0000 2017	Ο κ. @AdonisGeorgiadi είναι δική μου επιλογή. Δεν συμφωνώ με την επισήμανση σας κ. Φωτόπουλε πως ο λόγος του είναι ακραίος. #ΔΕΘ2017
2047	Sun Sep 17 11:25:01 +0000 2017	Η Κύπρος δεν αύξησε ούτε ένα φόρο. Μείωσε δημόσιες δαπάνες και πέτυχε σωστή δημοσιονομική προσαρμογή. Αυτήν την πρακτική θα ακολουθήσουμε.
2048	Sun Sep 17 11:24:08 +0000 2017	.@aggelos1973 Θέλω η Βόρεια Ελλάδα να ξαναγίνει ένα κέντρο βιομηχανίας &amp; μεταποίησης. Θέλω την Θεσσαλονίκη κέντρο καινοτομίας &amp; εκπαίδευσης.
2049	Sun Sep 17 11:22:37 +0000 2017	.@alexiatasouli Ακόμη κι αν είμαστε αυτοδύναμοι θα διεκδικήσουμε συνεργασίες με άλλα δημοκρατικά κόμματα. Όχι όμως τον ΣΥΡΙΖΑ. #ΔΕΘ2017
2050	Sun Sep 17 11:16:47 +0000 2017	.@thlapanaitis Η βελτίωση των μισθών μπορεί να προκύψει μόνο από την γρήγορη αποκλιμάκωση της ανεργίας μέσω ιδιωτικών επενδύσεων. #ΔΕΘ2017
2051	Sun Sep 17 11:11:31 +0000 2017	Σας φαίνομαι για ακροδεξιός κα @DKroustalli ; Ας σοβαρευτούμε λίγο. #ΔΕΘ2017
2052	Sun Sep 17 11:10:17 +0000 2017	Οι πολίτες γνωρίζουν πόσο εξαπατήθηκαν από τον κ. Τσίπρα. Εγώ θέλω να μιλήσω για το μέλλον, όχι για το παρελθόν. #ΔΕΘ2017
2053	Sun Sep 17 11:04:26 +0000 2017	Η αγορά των τυχερών παιγνίων είναι ευαίσθητη. Θέλουμε τον ανταγωνισμό αλλά θέλουμε και ένα αυστηρό εποπτικό πλαίσιο. #ΔΕΘ2017
2054	Sun Sep 17 11:00:12 +0000 2017	.@narmenis Ως αντιπολίτευση ζητώ από επενδυτές να έρθουν να επενδύσουν στην Ελλάδα. Δεν απειλώ ότι θα τους διώξουμε όπως έκανε ο κ. Τσίπρας.
2055	Sun Sep 17 10:57:22 +0000 2017	.@chriskose Θα προτείνουμε αποσύνδεση προεδρικής εκλογής με εθνικές εκλογές καθώς &amp; ένα νέο καινοτόμο και τολμηρό εκλογικό σύστημα. #ΔΕΘ2017
2056	Sun Sep 17 10:54:33 +0000 2017	.@gsiadimas Μεγάλη μείωση φόρων. Μεγάλη αυστηρότητα στην φοροδιαφυγή. Αυτή θα είναι η πολιτική μας. #ΔΕΘ2017 #Αξίζουμε_καλύτερα
2057	Sun Sep 17 10:53:10 +0000 2017	.@Manosharas Για να φανούν τα νέα πρόσωπα, θα πρέπει κι εσείς οι δημοσιογράφοι να τους δίνετε βήμα. #ΔΕΘ2017
2058	Sun Sep 17 10:51:29 +0000 2017	.@dimkott Οι ευρωπαίοι εταίροι μας δέχθηκαν την επιλογή της κυβέρνησης να υπερφορολογήσει τους αδύναμους και τη μεσαία τάξη. Έκαναν λάθος.
2059	Sun Sep 17 10:47:29 +0000 2017	.@dimaresi1 Έπρεπε να διασυρθεί η χώρα για να πειστεί ο κ. Σταθάκης να υπογράψει; Δεν ξέρουν, δεν μπορούν &amp; δεν θέλουν τις επενδύσεις.
2060	Sun Sep 17 10:41:47 +0000 2017	.@kantelis Για την τεράστια περιβαλλοντική καταστροφή υπάρχουν ευθύνες. Ο κ. Κουρουμπλής θα έπρεπε ήδη να έχει παραιτηθεί. #ΔΕΘ2017
2061	Sun Sep 17 10:36:08 +0000 2017	.@SYNTHIASAPIKA Η κυβέρνηση επαναλαμβάνει τις χειρότερες πρακτικές του χθες. Για αυτό και δεν μπορεί να διεκδικήσει μείωση πλεονασμάτων.
2062	Sun Sep 17 10:34:20 +0000 2017	Είμαι υπέρ ενός Εθνικού Συμβουλίου Φοιτητών ώστε να αλλάξει ο ρόλος των φοιτητικών παρατάξεων και να τελειώσουν οι πελατειακές σχέσεις.
2063	Sun Sep 17 10:28:58 +0000 2017	.@DimitrisGatsios Καμία σοβαρή χώρα δεν θα άφηνε ανεκμετάλλευτο τον ορυκτό της πλούτο. Απλοποιούμε τον τρόπο αδειοδότησης για τις επενδύσεις
2064	Sun Sep 17 10:19:47 +0000 2017	".@PeloniAris αν είχαμε πραγματικά καθαρή έξοδο,δεν θα χρειαζόταν έγκριση πιστωτών για τα όποια ""αντίμετρα"". Διαρκές αίτημα η πολιτική αλλαγή"
2065	Sun Sep 17 10:17:38 +0000 2017	.@gretziov η καλύτερη κοινωνική πολιτική είναι να βρούμε δουλειές στους ανέργους. Όχι να διαχειριζόμαστε επιδόματα με ημερομηνία λήξης.
2066	Sun Sep 17 10:12:58 +0000 2017	Κε @vaggelisplakas το 4ο Μνημόνιο είναι εδώ με υπογραφή Τσίπρα. Η ανάκτηση αξιοπιστίας περνάει μέσα από τολμηρή υλοποίηση μεγάλων αλλαγών.
2067	Sun Sep 17 10:09:59 +0000 2017	Δεν είμαι αυτός που τη μια μέρα φοράει το κοστούμι του επενδυτή και την άλλη μέρα το αμπέχονο του διαδηλωτή. #ΔΕΘ2017 #Αξίζουμε_καλύτερα
2068	Sun Sep 17 10:04:27 +0000 2017	Δείτε live τη Συνέντευξη Τύπου στην 82η Διεθνή Έκθεση Θεσσαλονίκης. #ΔΕΘ2017 #Αξίζουμε_Καλύτερα https://t.co/5vfmcbfAb8
2069	Sat Sep 16 18:14:32 +0000 2017	Ας προχωρήσουµε µε το κεφάλι ψηλά. Ας γράψουµε την δική µας ιστορία. #ΔΕΘ2017 #Αξίζουμε_Καλύτερα https://t.co/KKCw7mUJ00
2070	Sat Sep 16 18:13:46 +0000 2017	Σας ζητώ να µε εµπιστευθείτε. Γιατί κι εγώ εµπιστεύοµαι τη δηµιουργική δύναµη αυτού του λαού. #ΔΕΘ2017 #Αξίζουμε_Καλύτερα https://t.co/ztjlnoPAIk
2071	Sat Sep 16 18:10:11 +0000 2017	Την Ελλάδα που οραµατίζοµαι τη χτίζουν µαζί &amp; από κοινού εργαζόµενοι &amp; επιχειρηµατίες. Κοινά είναι τα συµφέροντα. Κοινοί οι στόχοι. #ΔΕΘ2017
2072	Sat Sep 16 18:10:07 +0000 2017	Έχουµε σχεδιάσει τις απαραίτητες παρεµβάσεις στον Πτωχευτικό Κώδικα προκειµένου να παρέχεται ουσιαστική «δεύτερη ευκαιρία». #ΔΕΘ2017 https://t.co/Q2SMhzQNcY
2073	Sat Sep 16 18:09:22 +0000 2017	Αν οι εργαζόµενοι και η εργοδοσία µιας επιχείρησης συµφωνήσουν, κανένας συνδικαλιστής δεν θα χρειάζεται να ευλογήσει τη συµφωνία. #ΔΕΘ2017 https://t.co/Z2i0pqHyZJ
2074	Sat Sep 16 18:08:30 +0000 2017	Θα είµαστε αµείλικτοι στην αντιµετώπιση των εργοδοτών που παραβιάζουν τη νοµοθεσία και εκµεταλλεύονται το προσωπικό τους. #ΔΕΘ2017
2075	Sat Sep 16 18:08:22 +0000 2017	Στην σύγχρονη Ελλάδα κοινωνική πολιτική πρέπει να είναι κατά κύριο λόγο η εξασφάλιση δουλειάς. #Αξίζουµε_Καλύτερα #ΔΕΘ2017
2076	Sat Sep 16 18:03:23 +0000 2017	Μεγάλη προσωπική έµφαση θα δώσω στην έµπρακτη στήριξη της νεανικής επιχειρηµατικότητας. #ΔΕΘ2017 #Αξίζουμε_Καλύτερα https://t.co/EMj4mPFs74
2077	Sat Sep 16 18:01:34 +0000 2017	Η ΔΑΠ θα επανιδρυθεί σε άλλη λογική. Οι φοιτητές δεν θα ψηφίζουν στις εκλογές των πρυτανικών οργάνων. #ΔΕΘ2017 #Αξίζουμε_καλύτερα https://t.co/swz1WAt3HL
2078	Sat Sep 16 18:00:53 +0000 2017	Οι νόµοι Μπαλτά-Φίλη-Γαβρόγλου καταργούνται. #ΔΕΘ2017 #Αξίζουµε_Καλύτερα
2079	Sat Sep 16 17:59:10 +0000 2017	Τα πανεπιστήµια θα αξιολογούνται από Ανεξάρτητη Αρχή Διασφάλισης Ποιότητας. Μέρος της χρηµατοδότησής τους θα εξαρτάται από την απόδοσή τους.
2080	Sat Sep 16 17:55:44 +0000 2017	Μια Ελλάδα που δεν επενδύει στη νέα γενιά δεν έχει µέλλον. Mια κοινωνία που δεν φροντίζει τους πιο αδύνατους δεν είναι κοινωνία. #ΔΕΘ2017 https://t.co/B07IZdHiPP
2081	Sat Sep 16 17:53:36 +0000 2017	Η χρήση µετρητών θα περιοριστεί δραµατικά. Όλες οι συναλλαγές µεταξύ επιχειρήσεων και µε το κράτος θα γίνονται ηλεκτρονικά. #ΔΕΘ2017 https://t.co/AiL73m74JO
2082	Sat Sep 16 17:44:29 +0000 2017	Όχι στην επιχειρηµατικότητα που λειτουργεί βασιζόµενη σε προνοµιακές σχέσεις µε τις τράπεζες, στη φοροδιαφυγή και στην µαύρη εργασία. https://t.co/jAPVjfmcKg
2083	Sat Sep 16 17:43:11 +0000 2017	Εισάγουµε το λευκό µητρώο επιχειρήσεων. #Αξίζουµε_Καλύτερα #ΔΕΘ2017 https://t.co/0zGp5wgtiW
2084	Sat Sep 16 17:38:16 +0000 2017	Θέλουµε εξορυκτική δραστηριότητα στη χώρα µας, πάντα µε σεβασµό στο περιβάλλον και στο αυστηρό κοινοτικό πλαίσιο. #ΔΕΘ2017 https://t.co/LzYdUuN6Lt
2085	Sat Sep 16 17:36:49 +0000 2017	Δίνουµε γενναία κίνητρα για να ανακαινισθεί το απόθεµα των παλιών ακινήτων, να γίνουν πιο «πράσινα» και φιλικά στο περιβάλλον. #ΔΕΘ2017 https://t.co/JYDNsg7YdM
2086	Sat Sep 16 17:34:07 +0000 2017	Συνεργασία µε τον ιδιωτικό τοµέα για την τουριστική προβολή της χώρας µε την επιλογή ενός brand στο οποίο θα επενδύσουµε για πολλά χρόνια.
2087	Sat Sep 16 17:33:21 +0000 2017	Απόλυτη προτεραιότητα για τη νέα κυβέρνηση θα είναι η ταχύτατη υλοποίηση των σχεδιασµένων ιδιωτικοποιήσεων. #Αξίζουµε_Καλύτερα #ΔΕΘ2017 https://t.co/vsqsmfxKHP
2088	Sat Sep 16 17:30:35 +0000 2017	Κόντρα στη λογική της γραφειοκρατίας, εµείς αντιστρέφουµε το βάρος της απόδειξης της συµµόρφωσης από τον ιδιώτη στο κράτος. #ΔΕΘ2017 https://t.co/DywTnwhCj3
2089	Sat Sep 16 17:29:44 +0000 2017	Δεσµεύοµαι για δραστική απλοποίηση φορολογικής νοµοθεσίας µε εγγύηση ότι ο νέος φορολογικός νόµος δεν θα αλλάξει για τουλάχιστον µία 5ετία. https://t.co/XXz978PnKW
2090	Sat Sep 16 17:28:29 +0000 2017	Χρειάζεται µια κυβέρνηση των καλύτερων, όχι των κολλητών, των συγγενών και φίλων, που θα υλοποιήσει ένα τολµηρό σχέδιο αλλαγών. #ΔΕΘ2017 https://t.co/QkbcVlF1Sj
2091	Sat Sep 16 17:26:15 +0000 2017	Θα έχω πετύχει το στόχο µου αν όλο &amp; περισσότεροι συµπολίτες µας δουν τον εαυτό τους µέρος του σχεδίου μου για την πατρίδα. #ΔΕΘ2017
2092	Sat Sep 16 17:22:28 +0000 2017	Η αγωνία µου είναι να εξασφαλίσουµε ένα καλύτερο αύριο στη γενιά του. #Αξίζουµε_Καλύτερα #ΔΕΘ2017 https://t.co/MdTpnF5bjP
2093	Sat Sep 16 17:18:45 +0000 2017	Δεν έχω στο νου µου µόνο αριθµούς και δείκτες. Έχω πρώτα από όλα ανθρώπους. #Αξίζουµε_Καλύτερα #ΔΕΘ2017 https://t.co/E4Z1V7j688
2094	Sat Sep 16 17:16:47 +0000 2017	H Ελλάδα που εγώ οραµατίζοµαι είναι ένας κόσµος που ανατέλλει, όχι µια χώρα που δύει. #Αξίζουµε_Καλύτερα #ΔΕΘ2017
2095	Sat Sep 16 17:16:18 +0000 2017	Είµαστε εδώ για να δηµιουργήσουµε µια νέα Ελλάδα υγιή, δυνατή, υπερήφανη. #Αξίζουµε_Καλύτερα #ΔΕΘ2017
2096	Sat Sep 16 17:12:11 +0000 2017	Ζωντανά τώρα η ομιλία μου στην 82η ΔΕΘ. #Αξίζουµε_Καλύτερα #ΔΕΘ2017 https://t.co/5vfmcbfAb8
2097	Sat Sep 16 13:16:51 +0000 2017	Η Κίνα είναι ηγέτης σε τεχνολογικά πεδία, πολλά εκ των οποίων είναι σχετικά με το μοντέλο ανάπτυξης που οραματίζομαι.https://t.co/gaUdzgeWmm https://t.co/OL37wDpy7O
2098	Sat Sep 16 13:09:04 +0000 2017	Η Βόρεια Ελλάδα παίζει κεντρικό ρόλο στον τρόπο που αντιλαμβανόμαστε την αλλαγή του παραγωγικού μοντέλου της χώρας. https://t.co/XfkQeWgs9G https://t.co/5vK36qfgzc
2099	Sat Sep 16 13:05:01 +0000 2017	Η Βόρεια Ελλάδα πρέπει να γίνει κέντρο εκπαίδευσης, καινοτομίας, εξαγωγικής βιομηχανίας &amp; μεταποίησης, που θα προσελκύει τουρισμό 12 μήνες. https://t.co/8BEcsSukc5
2100	Fri Sep 15 15:45:11 +0000 2017	Περπάτησα νωρίτερα στο κέντρο της Θεσσαλονίκης, όπου συνομίλησα με νέους για τα καθημερινά τους προβλήματα. https://t.co/WhBjqdWsz7 https://t.co/nVS9sOEUfb
2101	Fri Sep 15 12:06:04 +0000 2017	Το νοσοκομείο Παπαγεωργίου δείχνει ότι υπάρχουν άνθρωποι που αντιλαμβάνονται ότι έχουν μια ευρύτερη υποχρέωση απέναντι στο κοινωνικό σύνολο. https://t.co/ycVeYnYf9Z
2102	Fri Sep 15 11:46:44 +0000 2017	Θα είμαστε απέναντι στην τυρανία της μετριότητας. Θα απελευθερώσουμε τις δημιουργικές δυνάμεις των πανεπιστημίων. #Thessaloniki #deth2017 https://t.co/9DMqiA94Ru
2103	Fri Sep 15 08:44:17 +0000 2017	Όραμά μου η #Thessaloniki &amp; η Βόρεια Ελλάδα να γίνουν πόλος υψηλής τεχνολογίας &amp; καινοτομίας.  #deth2017 https://t.co/SItoQUitHo
2104	Thu Sep 14 18:06:51 +0000 2017	Θαυμάζω πάρα πολύ την εργαζόμενη Ελληνίδα μάνα. Δεσμεύομαι οτι κανένα παιδί δεν θα μένει εκτός παιδικών σταθμών με κυβέρνηση Ν.Δ. https://t.co/5GSwlEkgFo
2105	Thu Sep 14 14:22:22 +0000 2017	Εμείς ως Νέα Δημοκρατία θέτουμε στη διάθεση των ειδικών, τις δικές μας οργανώσεις και τους δικούς μας εθελοντές. https://t.co/4CaNsY7WRs
2106	Thu Sep 14 12:07:32 +0000 2017	Καταθέτουμε σήμερα Επερώτηση στη Βουλή, ενώ οι ευρωβουλευτές μας διερευνούν τη δυνατότητα εξεύρεσης ευρωπαϊκών πόρων για την αποκατάσταση. https://t.co/Ws4OPmp1g9
2107	Thu Sep 14 11:40:05 +0000 2017	Tο ελάχιστο το οποίο μπορεί να κάνει ο κ. Τσίπρας, είναι να αποδεχθεί άμεσα την παραίτηση του κ. Κουρουμπλή. https://t.co/WNC7HTfUCt https://t.co/lBWnRRW8no
2108	Thu Sep 14 11:34:53 +0000 2017	Χρειάστηκαν δεκάδες χρόνια για να καθαρίσει ο Σαρωνικός και μια μέρα μόνο ανικανότητας για να γίνει μια πολύ μεγάλη περιβαλλοντική ζημιά. https://t.co/uam41hC8dA
2109	Wed Sep 13 18:29:16 +0000 2017	Συζήτησα νωρίτερα με νέες μητέρες στο Περιστέρι για την πρόσβαση και το ελεγκτικό πλαίσιο στην προσχολική αγωγή. https://t.co/GPlr0Tdtsn https://t.co/WncqCkNEUU
2110	Wed Sep 13 14:29:06 +0000 2017	Η ανάκαμψη της πατρίδας μας θα έρθει με την αφύπνιση των πολιτών που αποτελούν το μεγαλύτερο κεφάλαιο αυτής της χώρας. https://t.co/PIjGkkFuG6
2111	Wed Sep 13 12:29:46 +0000 2017	Μπλοκάρουν την επένδυση στο όνομα της δήθεν οικολογικής ευαισθησίας.  Αλλά αδιαφορούν για την καταστροφή στη Σαλαμίνα.
2112	Tue Sep 12 16:51:08 +0000 2017	Η προσπάθεια για συνεχή βελτίωση είναι στάση ζωής. Κάθε οργανωμένη κοινωνία πρέπει να επιβραβεύει όσους δεν συμβιβάζονται με τη μετριότητα. https://t.co/LbU08v6pfU
